{
  "analysis_code_version": "09a539fe1235c0ff85ea8893ddbb3deaba15f9da",
  "evidence_classes": [
    "EXACT_REPLAY",
    "FIXED_ROUTE_COUNTERFACTUAL"
  ],
  "figure_id": "F07",
  "input_source_sha256": [
    "00974cfe319a79901de6322aeea32ce0205e2a84e1a783ab767c9171b2af400f",
    "00ae2fdfb09568af8d0fc0b1ebd4484029075c185e2fca04602dcb11637dfe1b",
    "0927db654db7b106584a5099415733edc65ed505a631836268158dc94d876889",
    "094c24d78ab6f5bdc8d16519ddbe1126c84fa8800f453eb85729884ee1014d92",
    "0e04919aec7143dac60c510951e8211b6d8bc7f18e0f516439a7b3094bfa5dd5",
    "0ea0489cd436aecf0d1261df1ae834e66149537c91ee4415050ad4bab439446b",
    "11a7b36b929b39cb303584442b28124566d18ee5d02144c1df527db330b9d4ed",
    "12d850801662811e8e418a9c28e50835d53c620ae0a6e11c8acadf36e9d3e431",
    "18ab89a63b63f6c96a0e0aa4807fcf152aed251b441ab77a8b593bcb35929ba0",
    "1c67745a4f933322d5698b09e61b0c133a99ea9214149400206fe2e0c3e004ef",
    "20af69ef77e69f48779e0f6e38c9254e9127b3aba0917aa53f827d5d533a33a9",
    "21e23108a07ad69f63b35b73bded71cc0c146202b85af1117ff8f2956582759c",
    "25f282940d91c9adcefccf1c86955ce69bbdd033b49fb0460285791af70b4230",
    "32effda4c65deaf8ae315eaf94b1ec42294f6a61851227a336abcccd604e1b2d",
    "48e746b49a9d1ccda8fd60a91872eeaf03ac38d83ff900ea16a3c5f5a3811e54",
    "4afd133672f4efd1f4f9c594529ae0826a6590359a5994efc77c1d1bad8d77d5",
    "4ef3c41d4799bab0a8601943b4803f8fb7244806c9a058e7842e26ba1f8fd108",
    "50c542f24657df86cdf1b83385335e40eeb850f676142cbd8b0abb3e7f58fe1e",
    "5446636d4a2659d92e71f1d319bf7701196a4e31553247857eaa54bb5b4ab064",
    "660895b18301ca877ec094c5605427e5c132b2d4215167d03ce92048084c0a24",
    "6c6f55624e99334f228a2934fbc75ff9fd5f892579f10295a373f073e0273d2c",
    "6d340743af8075222c0e12684b4403723d5bbb494cf56450da83f62b1ae1854c",
    "76eac0bc80147e7a7bec21b268fa0882ea0c1fb64bf19a88a92d49cd407d3fed",
    "7a59040b254ea460befc42720456d2afcf99af75bccb20eaa8e1e219a22e8ac0",
    "82e9e16c2c76c7ccbe57ef73083b9a0122a506b03289db1c78525afaed3c8d15",
    "860bdf5e13fbab90294309b9652b3240b2c40217c72f6a8e84be6fcec61d5261",
    "87813ce819b5e5bba2ed451b9e4664e238b065aa22122e3b536762fba9325b96",
    "8c28bf5a8c15335ed872e7a1a6882b16c6d4886d474c50699be85dcb05ebfb3c",
    "8da137779e43af3b0c45d708b602a46242f00272d8783ef7d1458dd028a2eb73",
    "90964851b35daac6a17715d0c0c6e742ddd80cd020165d78f24ed0499b070fd9",
    "91d086139252d7555304b75faf04e624b1d873be0d379679bde30fceccc3b521",
    "9b7bdd806e6013ffa2ce2a19cb29145226c29953a545d110cab39be50de1eafc",
    "a6ccd8684295aa648007171379dfa20284a6e7a673478d5ec37d5e64f4a1e761",
    "ad568faaca11d2aa71df2c1acbf527903d99018816d59130844e95fc29c30629",
    "b5971b806780f5cb7e64e9bddff0040649cfacf91960d81e4bd7917149534e67",
    "b7295fb206b42ad866364290f41bf03b43cea52caf7aaf218884127863fe8f66",
    "b87d9461ff503e2d13675b08d0362d5675ab8b6a2481e2d19ee46027d0b0ea9d",
    "c408fe912169f7284b08671bd5abb720203542c1404a2437a37d598c0b42efc5",
    "c66e4e6a6bf734331b1490f9ea2cacf0eb309883c904dd0edc0de4a1f9bedef7",
    "c9a9cac79f9b628274d5cc993f7cf96057c4042bb0931da50ea2698bc83338c9",
    "e1fab368ce78869f1276ce7b0835b3017d4d4c87877bb6ebccb9a9611eb5a023",
    "e2d06dc826f6bbb3d455fe149870ab88628a348e5d01cea1220b32f7f4067658",
    "e3de04b44f994fc3e9a95ccd8e25423ee5c1075246d0a88e85590650e9bc31b7",
    "e7609656e3a646118e4e47e8156c77537d545963883bd4b37527eb00cc83b1bc",
    "e7e912f3f422b0c1c678bbdbec6566c2421bc39f58d717d2bf376af0fae541f5",
    "f0a795961cea21bb1a575c664ec21cbf1607f98f3e8f8bcc689da9440d59ae81",
    "f5d051688b02df839e0cea6dfc1fad591f6f2dbf60b17994f687e5340aaa8a5c"
  ],
  "input_table_logical_sha256": [
    "4731949078aa993195cafb1c351e056c0df6e557570a271949e62702a6ba62e3"
  ],
  "metric_definitions": [
    "capacity_slots",
    "hit_ratio",
    "loads_per_token"
  ],
  "output_figure_sha256": "0b267c0e501c56ed726851d0ebae5ffbde267050573eb68fca7a60c3d6428220",
  "output_status": "rendered",
  "projection_gate_status": "not_applicable",
  "query_filter_definition": "capacity_curves: phase=DECODE,status=pass; median by policy/class and slots",
  "schema_version": "issue105-figure-sidecar-v1"
}
