{
  "analysis_code_version": "f00453f6d5572bd915648537ee0828ab10a67f35",
  "evidence_classes": [
    "CURATED_FROM_MEASURED",
    "MEASURED_OBSERVER"
  ],
  "figure_id": "F05",
  "input_source_sha256": [
    "24d48e8cf0fdf2c981562231d1492f6c6890b01eccaae239d1ac7c8b63d05b47"
  ],
  "input_table_logical_sha256": [
    "3cea8da7f50b5b9c1b76399fee199fdd1f9192ab538e48776bc09477b92944a6"
  ],
  "metric_definitions": [
    "cosine_similarity"
  ],
  "output_figure_sha256": "68859b9ae830cf815bc9bfd037554c13911b0d3882ab1a52ed076ff8f76d38b7",
  "output_status": "rendered",
  "projection_gate_status": "not_applicable",
  "query_filter_definition": "frozen B1/B8 endpoint comparison sets",
  "schema_version": "issue105-figure-sidecar-v1"
}
